Symbol,Name,Country
DDI,DoubleDown Interactive Co. Ltd. American Depository Shares,South Korea
DDL,Dingdong (Cayman) Limited American Depositary Shares (each two representing three Ordinary Shares),
DDMX,DD3 Acquisition Corp. II Class A Common Stock,Mexico
DDMXU,DD3 Acquisition Corp. II Unit,Mexico
DDMXW,DD3 Acquisition Corp. II Warrant,Mexico
DDOG,Datadog Inc. Class A Common Stock,United States
DDS,Dillard's Inc. Common Stock,United States
DDT,Dillard's Capital Trust I,United States
DE,Deere & Company Common Stock,United States
DEA,Easterly Government Properties Inc. Common Stock,United States
DECK,Deckers Outdoor Corporation Common Stock,United States
DEI,Douglas Emmett Inc. Common Stock,United States
DELL,Dell Technologies Inc. Class C Common Stock ,
DEN,Denbury Inc. Common Stock,
DENN,Denny's Corporation Common Stock,United States
DEO,Diageo plc Common Stock,United Kingdom
DESP,Despegar.com Corp. Ordinary Shares,
DEX,Delaware Enhanced Global Dividend Common Shares of Beneficial Interest,United States
DFFN,Diffusion Pharmaceuticals Inc. Common Stock,United States
DFH,Dream Finders Homes Inc. Class A Common Stock,United States
DFIN,Donnelley Financial Solutions Inc. Common Stock ,
DFP,Flaherty & Crumrine Dynamic Preferred and Income Fund Inc. Common Stock,
DFPH,DFP Healthcare Acquisitions Corp. Class A Common Stock,United States
DFPHW,DFP Healthcare Acquisitions Corp. Warrant,United States
DFS,Discover Financial Services Common Stock,United States
DG,Dollar General Corporation Common Stock,United States
DGICA,Donegal Group Inc. Class A Common Stock,United States
DGICB,Donegal Group Inc. Class B Common Stock,United States
DGII,Digi International Inc. Common Stock,United States
DGLY,Digital Ally Inc. Common Stock,United States
DGNS,Dragoneer Growth Opportunities Corp. II Class A Ordinary Shares,United States
DGNU,Dragoneer Growth Opportunities Corp. III Class A Ordinary Shares,United States
DGX,Quest Diagnostics Incorporated Common Stock,United States
DH,Definitive Healthcare Corp. Class A Common Stock,United States
DHBC,DHB Capital Corp. Class A common stock,United States
DHBCU,DHB Capital Corp. Unit,United States
DHBCW,DHB Capital Corp. Warrant,United States
DHC,Diversified Healthcare Trust Common Shares of Beneficial Interest,United States
DHCA,DHC Acquisition Corp. Class A ordinary share,United States
DHCAU,DHC Acquisition Corp. Unit,United States
DHCAW,DHC Acquisition Corp. Warrant,United States
DHCNI,Diversified Healthcare Trust 5.625% Senior Notes due 2042,United States
DHCNL,Diversified Healthcare Trust 6.25% Senior Notes Due 2046,United States
DHF,BNY Mellon High Yield Strategies Fund Common Stock,United States
DHHC,DiamondHead Holdings Corp. Class A Common Stock,United States
DHHCU,DiamondHead Holdings Corp. Unit,United States
DHHCW,DiamondHead Holdings Corp. Warrant,United States
DHI,D.R. Horton Inc. Common Stock,United States
DHIL,Diamond Hill Investment Group Inc. Class A Common Stock,United States
DHR,Danaher Corporation Common Stock,United States
DHR^A,Danaher Corporation 4.75% Mandatory Convertible Preferred Stock Series A,United States
DHR^B,Danaher Corporation 5.00% Mandatory Convertible Preferred Stock Series B,United States
DHT,DHT Holdings Inc.,Jersey
DHX,DHI Group Inc. Common Stock,United States
DHY,Credit Suisse High Yield Bond Fund Common Stock,United States
DIAX,Nuveen Dow 30SM Dynamic Overwrite Fund Common Shares of Beneficial Interest,
DIBS,1stdibs.com Inc. Common Stock,United States
DICE,DICE Therapeutics Inc. Common Stock,United States
DIDI,DiDi Global Inc. American Depositary Shares (each four representing one Class A Ordinary Share),
DILA,DILA Capital Acquisition Corp. Class A Common Stock,Mexico
DILAU,DILA Capital Acquisition Corp. Unit,Mexico
DIN,Dine Brands Global Inc. Common Stock,United States
DIOD,Diodes Incorporated Common Stock,United States
DIS,Walt Disney Company (The) Common Stock,United States
DISA,Disruptive Acquisition Corporation I Class A Ordinary Shares,United States
DISAU,Disruptive Acquisition Corporation I Unit,United States
DISAW,Disruptive Acquisition Corporation I Warrant,United States
DISCA,Discovery Inc. Series A Common Stock,United States
DISCB,Discovery Inc. Series B Common Stock,United States
DISCK,Discovery Inc. Series C Common Stock,United States
DISH,DISH Network Corporation Class A Common Stock,United States
DIT,AMCON Distributing Company Common Stock,United States
DJCO,Daily Journal Corp. (S.C.) Common Stock,United States
DK,Delek US Holdings Inc. Common Stock,United States
DKDCA,Data Knights Acquisition Corp. Class A Common Stock,United Kingdom
DKDCW,Data Knights Acquisition Corp. Warrant,United Kingdom
DKL,Delek Logistics Partners L.P. Common Units representing Limited Partner Interests,United States
DKNG,DraftKings Inc. Class A Common Stock,United States
DKS,Dick's Sporting Goods Inc Common Stock,United States
DLA,Delta Apparel Inc. Common Stock,United States
DLB,Dolby Laboratories Common Stock,United States
DLCA,Deep Lake Capital Acquisition Corp. Class A Ordinary Shares,United States
DLCAU,Deep Lake Capital Acquisition Corp. Unit,United States
DLCAW,Deep Lake Capital Acquisition Corp. Warrant,United States
DLHC,DLH Holdings Corp.,United States
DLNG,Dynagas LNG Partners LP Common Units,Greece
DLNG^A,Dynagas LNG Partners LP 9.00% Series A Cumulative Redeemable Preferred Units,Greece
DLNG^B,Dynagas LNG Partners LP 8.75% Series B Fixed to Floating Rate Cumulative Redeemable Perpetual Preferred Units liquidation preference $25.00 per Uni,Greece
DLO,DLocal Limited Class A Common Shares,Uruguay
DLPN,Dolphin Entertainment Inc. Common Stock,United States
DLR,Digital Realty Trust Inc. Common Stock,United States
DLR^J,Digital Realty Trust Inc. 5.250% Series J Cumulative Redeemable Preferred Stock,United States
DLR^K,Digital Realty Trust Inc. 5.850% Series K Cumulative Redeemable Preferred Stock par value $0.01 per share,United States
DLR^L,Digital Realty Trust Inc. 5.200% Series L Cumulative Redeemable Preferred Stock,United States
DLTH,Duluth Holdings Inc. Class B Common Stock,United States
DLTR,Dollar Tree Inc. Common Stock,United States
DLX,Deluxe Corporation Common Stock,United States
DLY,DoubleLine Yield Opportunities Fund Common Shares of Beneficial Interest,
DM,Desktop Metal Inc. Class A Common Stock,
DMAC,DiaMedica Therapeutics Inc. Common Stock,United States
DMB,BNY Mellon Municipal Bond Infrastructure Fund Inc. Common Stock,
DMF,BNY Mellon Municipal Income Inc. Common Stock,United States
DMLP,Dorchester Minerals L.P. Common Units Representing Limited Partnership Interests,United States
DMO,Western Asset Mortgage Opportunity Fund Inc. Common Stock,United States
DMRC,Digimarc Corporation Common Stock,United States
DMS,Digital Media Solutions Inc. Class A Ordinary Shares,United States
DMTK,DermTech Inc. Common Stock,United States
DMYQ,dMY Technology Group Inc. IV Class A Common Stock,
DNA,Ginkgo Bioworks Holdings Inc. Class A Common Stock,United States
DNAA,Social Capital Suvretta Holdings Corp. I Class A Ordinary Share,United States
DNAB,Social Capital Suvretta Holdings Corp. II Class A Ordinary Shares,United States
DNAC,Social Capital Suvretta Holdings Corp. III Class A ordinary shares,United States
DNAD,Social Capital Suvretta Holdings Corp. IV Class A Ordinary Shares,United States
DNAY,Codex DNA Inc. Common Stock,United States
DNB,Dun & Bradstreet Holdings Inc. Common Stock,United States
DNLI,Denali Therapeutics Inc. Common Stock,United States
DNMR,Danimer Scientific Inc. Common Stock,
DNN,Denison Mines Corp Ordinary Shares (Canada),Canada
DNOW,NOW Inc. Common Stock,
DNP,DNP Select Income Fund Inc. Common Stock,United States
DNUT,Krispy Kreme Inc. Common Stock,United States
DNZ,D and Z Media Acquisition Corp. Class A Common Stock,
DOC,Physicians Realty Trust Common Shares of Beneficial Interest,United States
DOCN,DigitalOcean Holdings Inc. Common Stock,
DOCS,Doximity Inc. Class A Common Stock,
DOCU,DocuSign Inc. Common Stock,United States
DOGZ,Dogness (International) Corporation Class A Common Stock,China
DOLE,Dole plc Ordinary Shares,
DOMA,Doma Holdings Inc. Common Stock,
DOMO,Domo Inc. Class B Common Stock,United States
DOOO,BRP Inc. (Recreational Products) Common Subordinate Voting Shares,Canada
DOOR,Masonite International Corporation Ordinary Shares (Canada),Canada
DORM,Dorman Products Inc. Common Stock,United States
DOV,Dover Corporation Common Stock,United States
DOW,Dow Inc. Common Stock ,
DOX,Amdocs Limited Ordinary Shares,Guernsey
DOYU,DouYu International Holdings Limited ADS,China
DPG,Duff & Phelps Utility and Infrastructure Fund Inc.,United States
DPRO,Draganfly Inc. Common Shares,Canada
DPW,Ault Global Holdings Inc. Common Stock,United States
DPZ,Domino's Pizza Inc Common Stock,United States
DQ,DAQO New Energy Corp. American Depositary Shares each representing five ordinary shares,China
DRAY,Macondray Capital Acquisition Corp. I Class A Ordinary Shares,United States
DRAYU,Macondray Capital Acquisition Corp. I Unit,United States
DRAYW,Macondray Capital Acquisition Corp. I Warrant,United States
DRD,DRDGOLD Limited American Depositary Shares,South Africa
DRE,Duke Realty Corporation Common Stock,United States
DRH,Diamondrock Hospitality Company Common Stock,United States
DRH^A,Diamondrock Hospitality Company 8.250% Series A Cumulative Redeemable Preferred Stock,United States
DRI,Darden Restaurants Inc. Common Stock,United States
DRIO,DarioHealth Corp. Common Stock,Israel
DRMA,Dermata Therapeutics Inc. Common Stock,United States
DRMAW,Dermata Therapeutics Inc. Warrant,United States
DRNA,Dicerna Pharmaceuticals Inc. Common Stock,United States
DRQ,Dril-Quip Inc. Common Stock,United States
DRRX,DURECT Corporation Common Stock,United States
DRTT,DIRTT Environmental Solutions Ltd. Common Shares,Canada
DRVN,Driven Brands Holdings Inc. Common Stock,United States
DS,Drive Shack Inc.,United States
DS^B,Drive Shack Inc. Preferred Series B,United States
DS^C,Drive Shack Inc. Preferred Series C,United States
DS^D,Drive Shack Inc. Pfd Ser D,United States
DSAC,Duddell Street Acquisition Corp. Class A Ordinary Shares,Hong Kong
DSACW,Duddell Street Acquisition Corp. Warrant,Hong Kong
DSEY,Diversey Holdings Ltd. Ordinary Shares,United States
DSGN,Design Therapeutics Inc. Common Stock,United States
DSGX,Descartes Systems Group Inc. (The) Common Stock,Canada
DSKE,Daseke Inc. Common Stock,United States
DSKEW,Daseke Inc. Warrant,United States
DSL,DoubleLine Income Solutions Fund Common Shares of Beneficial Interests,
DSM,BNY Mellon Strategic Municipal Bond Fund Inc. Common Stock,United States
DSP,Viant Technology Inc. Class A Common Stock,United States
DSPG,DSP Group Inc. Common Stock,United States
DSS,DSS Inc. Common Stock,United States
DSU,Blackrock Debt Strategies Fund Inc. Common Stock,United States
DSWL,Deswell Industries Inc. Common Shares,Macau
DSX,Diana Shipping inc. common stock,Greece
DSX^B,Diana Shipping Inc. Perpetual Preferred Shares Series B (Marshall Islands),Greece
DT,Dynatrace Inc. Common Stock,United States
DTB,DTE Energy Company 2020 Series G 4.375% Junior Subordinated Debentures due 2080,United States
DTE,DTE Energy Company Common Stock,United States
DTEA,DAVIDsTEA Inc. Common Stock,Canada
DTF,DTF Tax-Free Income Inc. Common Stock,United States
DTIL,Precision BioSciences Inc. Common Stock,United States
DTLA^,Brookfield DTLA Inc. 7.625% Series A Cumulative Redeemable Preferred Stock,
DTM,DT Midstream Inc. Common Stock ,
DTOCW,Digital Transformation Opportunities Corp. Warrant,United States
DTP,DTE Energy Company 6.25% Corporate Units,United States
DTRTU,DTRT Health Acquisition Corp. Unit,United States
DTSS,Datasea Inc. Common Stock,China
DTST,Data Storage Corporation Common Stock,United States
DTSTW,Data Storage Corporation Warrant,United States
DTW,DTE Energy Company 2017 Series E 5.25% Junior Subordinated Debentures due 2077,United States
DTY,DTE Energy Company 2016 Series F 6.00% Junior Subordinated Debentures due 2076,United States
DUK,Duke Energy Corporation (Holding Company) Common Stock,United States
DUK^A,Duke Energy Corporation Depositary Shares each representing a 1/1000th interest in a share of 5.75% Series A Cumulative Redeemable Perpetual Preferred Stock,United States
DUKB,Duke Energy Corporation 5.625% Junior Subordinated Debentures due 2078,United States
DUNE,Dune Acquisition Corporation Class A Common Stock,United States
DUNEU,Dune Acquisition Corporation Unit,United States
DUNEW,Dune Acquisition Corporation Warrant,United States
DUO,Fangdd Network Group Ltd. American Depositary Shares,China
DUOL,Duolingo Inc. Class A Common Stock,United States
DUOT,Duos Technologies Group Inc. Common Stock,United States
DV,DoubleVerify Holdings Inc. Common Stock,
DVA,DaVita Inc. Common Stock,United States
DVAX,Dynavax Technologies Corporation Common Stock,United States
DVD,Dover Motorsports Inc. Common Stock,United States
DVN,Devon Energy Corporation Common Stock,United States
DWAC,Digital World Acquisition Corp. Class A Common Stock,United States
DWACU,Digital World Acquisition Corp. Units,United States
DWACW,Digital World Acquisition Corp. Warrants,United States
DWIN,Delwinds Insurance Acquisition Corp. Class A Common Stock,
DWSN,Dawson Geophysical Company Common Stock,United States
DX,Dynex Capital Inc. Common Stock,United States
DX^C,Dynex Capital Inc. 6.900% Series C Fixed-to-Floating Rate Cumulative Redeemable Preferred Stock,United States
DXC,DXC Technology Company Common Stock ,
DXCM,DexCom Inc. Common Stock,United States
DXF,Dunxin Financial Holdings Limited American Depositary Shares,China
DXLG,Destination XL Group Inc. Common Stock,United States
DXPE,DXP Enterprises Inc. Common Stock,United States
DXR,Daxor Corporation Common Stock,United States
DXYN,Dixie Group Inc. (The) Common Stock,United States
DY,Dycom Industries Inc. Common Stock,United States
DYAI,Dyadic International Inc. Common Stock,United States
DYFN,Angel Oak Dynamic Financial Strategies Income Term Trust Common Shares of Beneficial Interest,
DYN,Dyne Therapeutics Inc. Common Stock,United States
DYNS,Dynamics Special Purpose Corp. Class A Common Stock,United States
DYNT,Dynatronics Corporation Common Stock,United States
DZSI,DZS Inc. Common Stock,United States
E,ENI S.p.A. Common Stock,Italy
EA,Electronic Arts Inc. Common Stock,United States
EAC,Edify Acquisition Corp. Class A Common Stock,United States
EACPU,Edify Acquisition Corp. Units,United States
EACPW,Edify Acquisition Corp. Warrant,United States
EAD,Wells Fargo Income Opportunities Fund Common Shares,United States
EAF,GrafTech International Ltd. Common Stock,United States
EAI,Entergy Arkansas LLC First Mortgage Bonds 4.875% Series Due September 1 2066,United States
EAR,Eargo Inc. Common Stock,United States
EARN,Ellington Residential Mortgage REIT Common Shares of Beneficial Interest,United States
EAST,Eastside Distilling Inc. Common Stock,United States
EAT,Brinker International Inc. Common Stock,United States
EB,Eventbrite Inc. Class A Common Stock,United States
EBAC,European Biotech Acquisition Corp. Class A Ordinary Shares,Netherlands
EBACU,European Biotech Acquisition Corp. Units,Netherlands
EBACW,European Biotech Acquisition Corp. Warrant,Netherlands
EBAY,eBay Inc. Common Stock,United States
EBC,Eastern Bankshares Inc. Common Stock,United States
EBET,Esports Technologies Inc. Common Stock,United States
EBF,Ennis Inc. Common Stock,United States
EBIX,Ebix Inc. Common Stock,United States
EBMT,Eagle Bancorp Montana Inc. Common Stock,United States
EBON,Ebang International Holdings Inc. Class A Ordinary Shares,China
EBR,Centrais Electricas Brasileiras S A American Depositary Shares (Each representing one Common Share),
EBS,Emergent Biosolutions Inc. Common Stock,United States
EBSB,Meridian Bancorp Inc. Common Stock,United States
EBTC,Enterprise Bancorp Inc Common Stock,United States
EC,Ecopetrol S.A. American Depositary Shares,Colombia
ECAT,BlackRock ESG Capital Allocation Trust Common Shares of Beneficial Interest,
ECC           ,Eagle Point Credit Company Inc. Common Stock,United States
ECCB,Eagle Point Credit Company Inc. 7.75% Series B Term Preferred Stock due 2026,United States
ECCC,Eagle Point Credit Company Inc. 6.50% Series C Term Preferred Stock due 2031,United States
ECCW,Eagle Point Credit Company Inc. 6.75% Notes due 2031,United States
ECCX,Eagle Point Credit Company Inc. 6.6875% Notes due 2028,United States
ECCY,Eagle Point Credit Company Inc. 6.75% Notes due 2027,United States
ECF,Ellsworth Growth and Income Fund Ltd.,United States
ECF^A,Ellsworth Growth and Income Fund Ltd. 5.25% Series A Cumulative Preferred Shares (Liquidation Preference $25.00 per share),United States
ECHO,Echo Global Logistics Inc. Common Stock,United States
ECL,Ecolab Inc. Common Stock,United States
ECOL,US Ecology Inc Common Stock,United States
ECOLW,US Ecology Inc. Warrant,United States
ECOM          ,ChannelAdvisor Corporation Common Stock,United States
ECOR,electroCore Inc. Common Stock,United States
ECPG,Encore Capital Group Inc Common Stock,United States
ECVT,Ecovyst Inc. Common Stock,United States
ED,Consolidated Edison Inc. Common Stock,United States
EDAP,EDAP TMS S.A. American Depositary Shares,France
EDD,Morgan Stanley Emerging Markets Domestic Debt Fund Inc. Morgan Stanley Emerging Markets Domestic Debt Fund Inc. Common Stock,United States
EDF,Stone Harbor Emerging Markets Income Fund Common Shares of Beneficial Interest,United States
EDI,Stone Harbor Emerging Markets Total Income Fund Common Shares of Beneficial Interests,United States
EDIT,Editas Medicine Inc. Common Stock,United States
EDN,Empresa Distribuidora Y Comercializadora Norte S.A. (Edenor) Empresa Distribuidora Y Comercializadora Norte S.A. (Edenor) American Depositary Shares,Argentina
EDNCU,Endurance Acquisition Corp. Unit,United States
EDR,Endeavor Group Holdings Inc. Class A Common Stock,
EDRY,EuroDry Ltd. Common Shares ,Greece
EDSA,Edesa Biotech Inc. Common Shares,United States
EDTK,Skillful Craftsman Education Technology Limited Ordinary Share,China
EDTX,EdtechX Holdings Acquisition Corp. II Class A common stock,United Kingdom
EDTXU,EdtechX Holdings Acquisition Corp. II Unit,United Kingdom
EDTXW,EdtechX Holdings Acquisition Corp. II Warrant,United Kingdom
EDU,New Oriental Education & Technology Group Inc. Sponsored ADR representing 1 Ordinary Share (Cayman Islands),China
EDUC,Educational Development Corporation Common Stock,United States
EEA,The European Equity Fund Inc. Common Stock,United States
EEFT,Euronet Worldwide Inc. Common Stock,United States
EEIQ,Elite Education Group International Ltd. Common Stock,United States
EEX,Emerald Holding Inc. Common Stock,United States
EFC,Ellington Financial Inc. Common Stock ,United States
EFC^A,Ellington Financial Inc. 6.750% Series A Fixed-to-Floating Rate Cumulative Redeemable Preferred Stock,United States
EFL,Eaton Vance Floating-Rate 2022 Target Term Trust Common Shares of Beneficial Interest,United States
EFOI,Energy Focus Inc. Common Stock,United States
EFR,Eaton Vance Senior Floating-Rate Fund Common Shares of Beneficial Interest,United States
EFSC,Enterprise Financial Services Corporation Common Stock,United States
EFT,Eaton Vance Floating Rate Income Trust Common Shares of Beneficial Interest,United States
EFTR,eFFECTOR Therapeutics Inc. Common Stock,United States
EFTRW,eFFECTOR Therapeutics Inc. Warrant,United States
EFX,Equifax Inc. Common Stock,United States
EGAN,eGain Corporation Common Stock,United States
EGBN,Eagle Bancorp Inc. Common Stock,United States
EGF,Blackrock Enhanced Government Fund Inc. Common Stock,United States
EGGF,EG Acquisition Corp. Class A Common Stock,
EGHT,8x8 Inc Common Stock,United States
EGLE,Eagle Bulk Shipping Inc. Common Stock,United States
EGLX,Enthusiast Gaming Holdings Inc. Common Stock,Canada
EGO,Eldorado Gold Corporation Ordinary Shares,Canada
EGP,EastGroup Properties Inc. Common Stock,United States
EGRX,Eagle Pharmaceuticals Inc. Common Stock,United States
EGY,VAALCO Energy Inc.  Common Stock,United States
EH,EHang Holdings Limited ADS,China
EHC,Encompass Health Corporation Common Stock,United States
EHI,Western Asset Global High Income Fund Inc Common Stock,United States
EHTH,eHealth Inc. Common Stock,United States
EIC,Eagle Point Income Company Inc. Common Stock,
EIG,Employers Holdings Inc Common Stock,United States
EIGR,Eiger BioPharmaceuticals Inc. Common Stock,United States
EIM,Eaton Vance Municipal Bond Fund Common Shares of Beneficial Interest $.01 par value,United States
EIX,Edison International Common Stock,United States
EJFA,EJF Acquisition Corp. Class A Ordinary Share,United States
EJFAU,EJF Acquisition Corp. Unit,United States
EJFAW,EJF Acquisition Corp. Warrant,United States
EJH,E-Home Household Service Holdings Limited Ordinary Shares,China
EKSO,Ekso Bionics Holdings Inc. Common Stock,United States
EL,Estee Lauder Companies Inc. (The) Common Stock,United States
ELA,Envela Corporation Common Stock,United States
ELAN,Elanco Animal Health Incorporated Common Stock,United States
ELAT,Elanco Animal Health Incorporated 5.00% Tangible Equity Units,United States
ELC,Entergy Louisiana Inc. Collateral Trust Mortgage Bonds 4.875 % Series due September 1 2066,United States
ELDN,Eledon Pharmaceuticals Inc. Common Stock,United States
ELEV,Elevation Oncology Inc. Common stock,United States
ELF,e.l.f. Beauty Inc. Common Stock,United States
ELLO,Ellomay Capital Ltd Ordinary Shares (Israel),Israel
ELMD,Electromed Inc. Common Stock,United States
ELMS,Electric Last Mile Solutions Inc. Class A Common stock,United States
ELMSW,Electric Last Mile Solutions Inc. Warrant,United States
ELOX,Eloxx Pharmaceuticals Inc. Common Stock,United States
ELP,Companhia Paranaense de Energia (COPEL) American Depositary Shares (each representing one Unit consisting one Common Share and four non-voting Class B Preferred Shares),Brazil
ELS,Equity Lifestyle Properties Inc. Common Stock,United States
ELSE,Electro-Sensors Inc. Common Stock,United States
ELTK,Eltek Ltd. Ordinary Shares,Israel
ELVT,Elevate Credit Inc. Common Stock,United States
ELY,Callaway Golf Company Common Stock,United States
ELYM,Eliem Therapeutics Inc Common Stock,United States
ELYS,Elys Game Technology Corp. Common Stock,Canada
EM,Smart Share Global Limited American Depositary Shares,China
EMAN,eMagin Corporation Common Stock,United States
EMCF,Emclaire Financial Corp Common Stock,United States
EMD,Western Asset Emerging Markets Debt Fund Inc Common Stock,United States
EME,EMCOR Group Inc. Common Stock,United States
EMF,Templeton Emerging Markets Fund Common Stock,United States
EMKR,EMCORE Corporation Common Stock,United States
EML,Eastern Company (The) Common Stock,United States
EMN,Eastman Chemical Company Common Stock,United States
EMO,ClearBridge Energy Midstream Opportunity Fund Inc. Common Stock,United States
EMP,Entergy Mississippi LLC First Mortgage Bonds 4.90% Series Due October 1 2066,United States
EMR,Emerson Electric Company Common Stock,United States
EMX,EMX Royalty Corporation Common Shares (Canada),Canada
ENB,Enbridge Inc Common Stock,Canada
ENBA,Enbridge Inc 6.375% Fixed-to-Floating Rate Subordinated Notes Series 2018-B due 2078,Canada
ENBL,Enable Midstream Partners LP Common Units representing limited partner interests,
ENDP,Endo International plc Ordinary Shares,Ireland
ENFA,890 5th Avenue Partners Inc. Class A Common Stock,United States
ENFAU,890 5th Avenue Partners Inc. Unit,United States
ENFAW,890 5th Avenue Partners Inc. Warrant,United States
ENG,ENGlobal Corporation Common Stock,United States
ENIA,Enel Americas S.A. American Depositary Shares,Chile
ENIC,Enel Chile S.A. American Depositary Shares (Each representing 50 shares of Common Stock),
ENJ,Entergy New Orleans LLC First Mortgage Bonds 5.0% Series due December 1 2052,United States
ENLC,EnLink Midstream LLC Common Units representing Limited Partner Interests,
ENLV,Enlivex Therapeutics Ltd. Ordinary Shares,Israel
ENNV,ECP Environmental Growth Opportunities Corp. Class A Common Stock,United States
ENNVU,ECP Environmental Growth Opportunities Corp. Unit,United States
ENNVW,ECP Environmental Growth Opportunities Corp. Warrants,United States
ENO,Entergy New Orleans LLC First Mortgage Bonds 5.50% Series due April 1 2066,United States
ENOB,Enochian Biosciences Inc. Common Stock,United States
ENPC,Executive Network Partnering Corporation Class A Common Stock,
ENPH,Enphase Energy Inc. Common Stock,United States
ENR,Energizer Holdings Inc. Common Stock,United States
ENR^A,Energizer Holdings Inc. 7.50% Series A Mandatory Convertible Preferred Stock,United States
ENS,EnerSys Common Stock,United States
ENSC,Ensysce Biosciences Inc. Common Stock,United States
ENSG,The Ensign Group Inc. Common Stock,United States
ENSV,Enservco Corporation Common Stock,United States
ENTA,Enanta Pharmaceuticals Inc. Common Stock,United States
ENTG,Entegris Inc. Common Stock,United States
ENTX,Entera Bio Ltd. Ordinary Shares,Israel
ENTXW,Entera Bio Ltd. Warrant,Israel
ENV,Envestnet Inc Common Stock,United States
ENVA,Enova International Inc. Common Stock,United States
ENVB,Enveric Biosciences Inc. Common Stock,United States
ENVI,Environmental Impact Acquisition Corp. Class A Common Stock,United States
ENVIU,Environmental Impact Acquisition Corp. Unit,United States
ENVIW,Environmental Impact Acquisition Corp. Warrant,United States
ENVX,Enovix Corporation Common Stock,United States
ENVXW,Enovix Corporation Warrant,United States
ENX,Eaton Vance New York Municipal Bond Fund Common Shares of Beneficial Interest $.01 par value,United States
ENZ,Enzo Biochem Inc. Common Stock ($0.01 Par Value),United States
EOCW,Elliott Opportunity II Corp. Class A Ordinary Shares,
