Symbol,Name,Country
JW/B,John Wiley & Sons Inc.,United States
JWEL,Jowell Global Ltd. Ordinary Shares,China
JWN,Nordstrom Inc. Common Stock,United States
JWSM,Jaws Mustang Acquisition Corp. Class A Ordinary Shares,
JXN,Jackson Financial Inc. Class A Common Stock ,
JYAC,Jiya Acquisition Corp. Class A Common Stock,United States
JYNT,The Joint Corp. Common Stock,United States
JZXN,Jiuzi Holdings Inc. Ordinary Shares,China
K,Kellogg Company Common Stock,United States
KAHC,KKR Acquisition Holdings I Corp. Class A Common Stock,
KAI,Kadant Inc Common Stock,United States
KAII,Kismet Acquisition Two Corp. Class A Ordinary Shares,United States
KAIIU,Kismet Acquisition Two Corp. Unit,United States
KAIIW,Kismet Acquisition Two Corp. Warrant,United States
KAIR,Kairos Acquisition Corp. Class A Ordinary Shares,United States
KAIRU,Kairos Acquisition Corp. Unit,United States
KAIRW,Kairos Acquisition Corp. Warrant,United States
KALA,Kala Pharmaceuticals Inc. Common Stock,United States
KALU,Kaiser Aluminum Corporation Common Stock,United States
KALV,KalVista Pharmaceuticals Inc. Common Stock,United Kingdom
KAMN,Kaman Corporation Common Stock,United States
KAR,KAR Auction Services Inc Common Stock,United States
KARO,Karooooo Ltd. Ordinary Shares,Singapore
KAVL,Kaival Brands Innovations Group Inc. Common Stock,United States
KB,KB Financial Group Inc,South Korea
KBAL,Kimball International Inc. Class B Common Stock,United States
KBH,KB Home Common Stock,United States
KBNT,Kubient Inc. Common Stock,United States
KBNTW,Kubient Inc. Warrant,United States
KBR,KBR Inc. Common Stock,United States
KC,Kingsoft Cloud Holdings Limited American Depositary Shares,China
KCGI,Kensington Capital Acquisition Corp. V Class A Ordinary Shares,
KDMN,Kadmon Holdings Inc. Common Stock,United States
KDNY,Chinook Therapeutics Inc. Common Stock,United States
KDP,Keurig Dr Pepper Inc. Common Stock,United States
KE,Kimball Electronics Inc. Common Stock,United States
KELYA,Kelly Services Inc. Class A Common Stock,United States
KELYB,Kelly Services Inc. Class B Common Stock,United States
KEN,Kenon Holdings Ltd. Ordinary Shares,Singapore
KEP,Korea Electric Power Corporation Common Stock,South Korea
KEQU,Kewaunee Scientific Corporation Common Stock,United States
KERN,Akerna Corp. Common Stock,United States
KERNW,Akerna Corp Warrant,United States
KEX,Kirby Corporation Common Stock,United States
KEY,KeyCorp Common Stock,United States
KEY^I,KeyCorp Depositary Shares Each Representing a 1/40th Ownership Interest in a Share of Fixed-to-Floating Rate Perpetual Non-Cumulative Preferred Stock Series E,United States
KEY^J,KeyCorp Depositary Shares each representing a 1/40th ownership interest in a share of Fixed Rate Perpetual Non-Cumulative Preferred Stock Series F,United States
KEY^K,KeyCorp Depositary Shares each representing a 1/40th ownership interest in a share of Fixed Rate Perpetual Non-Cumulative Preferred Stock Series G,United States
KEYS,Keysight Technologies Inc. Common Stock,United States
KF,Korea Fund Inc. (The) New Common Stock,United States
KFFB,Kentucky First Federal Bancorp Common Stock,United States
KFRC,Kforce Inc. Common Stock,United States
KFS,Kingsway Financial Services Inc. Common Stock (DE),Canada
KFY,Korn Ferry Common Stock,United States
KGC,Kinross Gold Corporation Common Stock,Canada
KHC,The Kraft Heinz Company Common Stock,United States
KIDS,OrthoPediatrics Corp. Common Stock,United States
KIII,Kismet Acquisition Three Corp. Class A Ordinary Shares,United States
KIIIU,Kismet Acquisition Three Corp. Unit,United States
KIIIW,Kismet Acquisition Three Corp. Warrant,United States
KIM,Kimco Realty Corporation Common Stock,United States
KIM^L,Kimco Realty Corporation Class L Depositary Shares each of which represents a one-one thousandth fractional interest in a share of 5.125% Class L Cumulative Redeemable Preferred Stock liquidation preference $25000.00 per share,United States
KIM^M,Kimco Realty Corporation Class M Depositary Shares each of which represents a one-one thousandth fractional interest in a share of 5.25% Class M Cumulative Redeemable Preferred Stock liquidation preference $25000.00 per share,United States
KINS,Kingstone Companies Inc. Common Stock,United States
KINZ,KINS Technology Group Inc. Class A Common Stock,United States
KINZW,KINS Technology Group Inc. Warrant,United States
KIO,KKR Income Opportunities Fund Common Shares,
KIQ,Kelso Technologies Inc Ordinary Shares,Canada
KIRK,Kirkland's Inc. COMMONSTOCK,United States
KKR,KKR & Co. Inc. Common Stock,United States
KKR^C,KKR & Co. Inc. 6.00% Series C Mandatory Convertible Preferred Stock,United States
KKRS,KKR Group Finance Co. IX LLC 4.625% Subordinated Notes due 2061,
KL,Kirkland Lake Gold Ltd. Common Shares,
KLAC,KLA Corporation Common Stock,United States
KLAQ,KL Acquisition Corp Class A Common Stock,United States
KLAQU,KL Acquisition Corp Unit,United States
KLAQW,KL Acquisition Corp Warrant,United States
KLDO,Kaleido Biosciences Inc. Common Stock,United States
KLIC,Kulicke and Soffa Industries Inc. Common Stock,Singapore
KLR,Kaleyra Inc. Common Stock,United States
KLTR,Kaltura Inc. Common Stock,United States
KLXE,KLX Energy Services Holdings Inc. Common Stock,United States
KMB,Kimberly-Clark Corporation Common Stock,United States
KMDA,Kamada Ltd. Ordinary Shares,Israel
KMF,Kayne Anderson NextGen Energy & Infrastructure Inc.,
KMI,Kinder Morgan Inc. Common Stock,United States
KMPH,KemPharm Inc. Common Stock,United States
KMPR,Kemper Corporation,United States
KMT,Kennametal Inc. Common Stock,United States
KMX,CarMax Inc,United States
KN,Knowles Corporation Common Stock,
KNBE,KnowBe4 Inc. Class A Common Stock,United States
KNDI,Kandi Technologies Group Inc Common Stock,China
KNOP,KNOT Offshore Partners LP Common Units representing Limited Partner Interests,United Kingdom
KNSA,Kiniksa Pharmaceuticals Ltd. Class A Common Stock,United States
KNSL,Kinsale Capital Group Inc. Common Stock,United States
KNTE,Kinnate Biopharma Inc. Common Stock,United States
KNX,Knight-Swift Transportation Holdings Inc.,United States
KO,Coca-Cola Company (The) Common Stock,United States
KOD,Kodiak Sciences Inc Common Stock,United States
KODK,Eastman Kodak Company Common New,United States
KOF,Coca Cola Femsa S.A.B. de C.V.  American Depositary Shares each representing 10 Units (each Unit consists of 3 Series B Shares and 5 Series L Shares),Mexico
KOP,Koppers Holdings Inc. Koppers Holdings Inc. Common Stock,United States
KOPN,Kopin Corporation Common Stock,United States
KOR,Corvus Gold Inc. Common Shares,Canada
KORE,KORE Group Holdings Inc. Common Stock,
KOS,Kosmos Energy Ltd. Common Shares (DE),Bermuda
KOSS,Koss Corporation Common Stock,United States
KPLT,Katapult Holdings Inc. Common Stock,United States
KPLTW,Katapult Holdings Inc. Warrant,United States
KPTI,Karyopharm Therapeutics Inc. Common Stock,United States
KR,Kroger Company (The) Common Stock,United States
KRA,Kraton Corporation Common Stock,United States
KRBP,Kiromic BioPharma Inc. Common Stock,United States
KRC,Kilroy Realty Corporation Common Stock,United States
KREF,KKR Real Estate Finance Trust Inc. Common Stock,United States
KREF^A,KKR Real Estate Finance Trust Inc. 6.50% Series A Cumulative Redeemable Preferred Stock,United States
KRG,Kite Realty Group Trust Common Stock,United States
KRKR,36Kr Holdings Inc. American Depositary Shares,China
KRMD,Repro Med Systems Inc. Common Stock,United States
KRNL,Kernel Group Holdings Inc. Class A Ordinary Shares,United States
KRNLW,Kernel Group Holdings Inc. Warrants,United States
KRNT,Kornit Digital Ltd. Ordinary Shares,Israel
KRNY,Kearny Financial Corp Common Stock,United States
KRO,Kronos Worldwide Inc Common Stock,United States
KRON,Kronos Bio Inc. Common Stock,United States
KROS,Keros Therapeutics Inc. Common Stock,United States
KRP,Kimbell Royalty Partners Common Units Representing Limited Partner Interests,United States
KRT,Karat Packaging Inc. Common Stock,United States
KRTX,Karuna Therapeutics Inc. Common Stock,United States
KRUS,Kura Sushi USA Inc. Class A Common Stock,United States
KRYS,Krystal Biotech Inc. Common Stock,United States
KSI,Kadem Sustainable Impact Corporation Class A common stock,United States
KSICW,Kadem Sustainable Impact Corporation Warrant,United States
KSM,DWS Strategic Municipal Income Trust,United States
KSPN,Kaspien Holdings Inc. Common Stock,United States
KSS,Kohl's Corporation Common Stock,United States
KSU,Kansas City Southern Common Stock,United States
KSU^,Kansas City Southern Preferred Stock,United States
KT,KT Corporation Common Stock,South Korea
KTB,Kontoor Brands Inc. Common Stock ,
KTCC,Key Tronic Corporation Common Stock,United States
KTF,DWS Municipal Income Trust,United States
KTH,Structures Products Cp 8% CorTS Issued by Peco Energy Cap Tr II Preferred Stock,United States
KTN,Structured Products Corp 8.205% CorTS 8.205% Corporate Backed Trust Securities (CorTS),United States
KTOS,Kratos Defense & Security Solutions Inc. Common Stock,United States
KTRA,Kintara Therapeutics Inc. Common Stock,United States
KTTA,Pasithea Therapeutics Corp. Common Stock,United States
KTTAW,Pasithea Therapeutics Corp. Warrant,United States
KUKE,Kuke Music Holding Limited American Depositary Shares each representing one Ordinary Share,
KULR,KULR Technology Group Inc. Common Stock,United States
KURA,Kura Oncology Inc. Common Stock,United States
KURI,Alkuri Global Acquisition Corp. Class A common stock,United States
KURIU,Alkuri Global Acquisition Corp. Unit,United States
KURIW,Alkuri Global Acquisition Corp. Warrant,United States
KVHI,KVH Industries Inc. Common Stock,United States
KVSA,Khosla Ventures Acquisition Co. Class A Common Stock,United States
KVSB,Khosla Ventures Acquisition Co. II Class A Common Stock,United States
KVSC,Khosla Ventures Acquisition Co. III Class A Common Stock,United States
KW,Kennedy-Wilson Holdings Inc. Common Stock,United States
KWAC,Kingswood Acquisition Corp. Class A Common Stock,
KWR,Quaker Chemical Corporation Common Stock,United States
KXIN,Kaixin Auto Holdings Ordinary Share,China
KYMR,Kymera Therapeutics Inc. Common Stock,United States
KYN,Kayne Anderson Energy Infrastructure Fund Inc.,United States
KZIA,Kazia Therapeutics Limited American Depositary Shares,Australia
KZR,Kezar Life Sciences Inc. Common Stock,United States
L,Loews Corporation Common Stock,United States
LAAA,Lakeshore Acquisition I Corp. Ordinary Shares,China
LAAAU,Lakeshore Acquisition I Corp. Unit,China
LAAAW,Lakeshore Acquisition I Corp. Warrant,China
LABP,Landos Biopharma Inc. Common Stock,United States
LAC,Lithium Americas Corp. Common Shares,Canada
LAD,Lithia Motors Inc. Common Stock,United States
LADR,Ladder Capital Corp Class A Common Stock,
LAIX,LAIX Inc. American Depositary Shares each  representing one Class A Ordinary Share,
LAKE,Lakeland Industries Inc. Common Stock,United States
LAMR,Lamar Advertising Company Class A Common Stock,United States
LANC,Lancaster Colony Corporation Common Stock,United States
LAND,Gladstone Land Corporation Common Stock,United States
LANDM,Gladstone Land Corporation 5.00% Series D Cumulative Term Preferred Stock,United States
LANDO,Gladstone Land Corporation 6.00% Series B Cumulative Redeemable Preferred Stock,United States
LARK,Landmark Bancorp Inc. Common Stock,United States
LASR,nLIGHT Inc. Common Stock,United States
LAUR,Laureate Education Inc. Class A Common Stock,United States
LAW,CS Disco Inc. Common Stock,United States
LAWS,Lawson Products Inc. Common Stock,United States
LAZ,Lazard LTD. Lazard LTD. Class A Common Stock,Bermuda
LAZR,Luminar Technologies Inc.  Class A Common Stock,United States
LAZY,Lazydays Holdings Inc. Common Stock,United States
LBAI,Lakeland Bancorp Inc. Common Stock,United States
LBC,Luther Burbank Corporation Common Stock,United States
LBPH,Longboard Pharmaceuticals Inc. Common Stock,United States
LBPS,4D pharma plc American Depositary Shares,United Kingdom
LBPSW,4D pharma plc Warrant,United Kingdom
LBRDA,Liberty Broadband Corporation Class A Common Stock,United States
LBRDK,Liberty Broadband Corporation Class C Common Stock,United States
LBRDP,Liberty Broadband Corporation Series A Cumulative Redeemable Preferred Stock,United States
LBRT,Liberty Oilfield Services Inc. Class A Common Stock,United States
LBTYA,Liberty Global plc Class A Ordinary Shares,United Kingdom
LBTYB,Liberty Global plc Class B Ordinary Shares,United Kingdom
LBTYK,Liberty Global plc Class C Ordinary Shares,United Kingdom
LC,LendingClub Corporation Common Stock,United States
LCA,Landcadia Holdings IV Inc. Class A Common Stock,United States
LCAA,L Catterton Asia Acquisition Corp Class A Ordinary Shares,Singapore
LCAAU,L Catterton Asia Acquisition Corp Units,Singapore
LCAAW,L Catterton Asia Acquisition Corp Warrant,Singapore
LCAHU,Landcadia Holdings IV Inc. Units,United States
LCAHW,Landcadia Holdings IV Inc. Warrant ,United States
LCAP,Lionheart Acquisition Corp. II Class A Common Stock,United States
LCAPU,Lionheart Acquisition Corp. II Unit,United States
LCAPW,Lionheart Acquisition Corp. II Warrant,United States
LCI,Lannett Co Inc Common Stock,United States
LCID,Lucid Group Inc. Common Stock,United States
LCII,LCI Industries,United States
LCNB,LCNB Corporation Common Stock,United States
LCTX,Lineage Cell Therapeutics Inc. Common Stock,United States
LCUT,Lifetime Brands Inc. Common Stock,United States
LDHA,LDH Growth Corp I Class A Ordinary Shares,United States
LDHAU,LDH Growth Corp I Units,United States
LDHAW,LDH Growth Corp I Warrant,United States
LDI,loanDepot Inc. Class A Common Stock,
LDOS,Leidos Holdings Inc. Common Stock,United States
LDP,Cohen & Steers Limited Duration Preferred and Income Fund Inc.,United States
LE,Lands' End Inc. Common Stock,United States
LEA,Lear Corporation Common Stock,United States
LEAP,Ribbit LEAP Ltd. Class A Ordinary Shares,United States
LECO,Lincoln Electric Holdings Inc. Common Shares,United States
LEDS,SemiLEDS Corporation Common Stock,Taiwan
LEE,Lee Enterprises Incorporated Common Stock,United States
LEG,Leggett & Platt Incorporated Common Stock,United States
LEGAW,Lead Edge Growth Opportunities Ltd Warrant,United States
LEGH,Legacy Housing Corporation Common Stock (TX),United States
LEGN,Legend Biotech Corporation American Depositary Shares,United States
LEGO,Legato Merger Corp. Common stock,United States
LEGOU,Legato Merger Corp. Units,United States
LEGOW,Legato Merger Corp. Warrant,United States
LEJU,Leju Holdings Limited American Depositary Shares each representing one Ordinary share,
LEN,Lennar Corporation Class A Common Stock,United States
LEO,BNY Mellon Strategic Municipals Inc. Common Stock,United States
LESL,Leslie's Inc. Common Stock,United States
LEU,Centrus Energy Corp. Class A Common Stock,United States
LEV,The Lion Electric Company Common Shares,
LEVI,Levi Strauss & Co Class A Common Stock,United States
LEVL,Level One Bancorp Inc. Common Stock,United States
LEVLP,Level One Bancorp Inc. Depositary Shares Each Representing a 1/100th Interest in a Share of 7.50% Non-Cumulative Perpetual Preferred Stock Series B,United States
LEXX,Lexaria Bioscience Corp. Common Stock,Canada
LEXXW,Lexaria Bioscience Corp. Warrant,Canada
LFC,China Life Insurance Company Limited American Depositary Shares,China
LFG,Archaea Energy Inc. Class A Common Stock,United States
LFMD,LifeMD Inc. Common Stock,United States
LFMDP,LifeMD Inc. 8.875% Series A Cumulative Perpetual Preferred Stock,United States
LFST,LifeStance Health Group Inc. Common Stock,United States
LFT,Lument Finance Trust Inc. Common Stock,United States
LFT^A,Lument Finance Trust Inc. 7.875% Series A Cumulative Redeemable Preferred Stock,United States
LFTR,Lefteris Acquisition Corp. Class A Common Stock,United States
LFTRU,Lefteris Acquisition Corp. Unit,United States
LFTRW,Lefteris Acquisition Corp. Warrant,United States
LFUS,Littelfuse Inc. Common Stock,United States
LFVN,Lifevantage Corporation Common Stock (Delaware),United States
LGAC,Lazard Growth Acquisition Corp. I Ordinary Shares,
LGACU,Lazard Growth Acquisition Corp. I Units,
LGACW,Lazard Growth Acquisition Corp. I Warrants,
LGHL,Lion Group Holding Ltd. American Depositary Share,China
LGHLW,Lion Group Holding Ltd. Warrant,China
LGI,Lazard Global Total Return and Income Fund Common Stock,United States
LGIH,LGI Homes Inc. Common Stock,United States
LGL,LGL Group Inc. (The) Common Stock,United States
LGND,Ligand Pharmaceuticals Incorporated Common Stock,United States
LGO,Largo Resources Ltd. Common Shares,Canada
LGV,Longview Acquisition Corp. II Class A Common Stock,
LGVN,Longeveron Inc. Class A Common Stock,United States
LH,Laboratory Corporation of America Holdings Common Stock,United States
LHAA,Lerer Hippeau Acquisition Corp. Class A Common Stock,United States
LHC,Leo Holdings Corp. II Class A Ordinary Shares,
LHCG,LHC Group Common Stock,United States
LHDX,Lucira Health Inc. Common Stock,United States
LHX,L3Harris Technologies Inc. Common Stock,United States
LI,Li Auto Inc. American Depositary Shares,China
LICY,Li-Cycle Holdings Corp. Common Shares,
LIDR,AEye Inc. Class A Common Stock,United States
LIDRW,AEye Inc. Warrant,United States
LIFE,aTyr Pharma Inc. Common Stock,United States
LII,Lennox International Inc. Common Stock,United States
LIII,Leo Holdings III Corp. Class A Ordinary Shares,
LILA,Liberty Latin America Ltd. Class A Common Stock,United States
LILAK,Liberty Latin America Ltd. Class C Common Stock,United States
LILM,Lilium N.V. Class A Ordinary Shares,Germany
LILMW,Lilium N.V. Warrants,Germany
LIN,Linde plc Ordinary Share,
LINC,Lincoln Educational Services Corporation Common Stock,United States
LIND,Lindblad Expeditions Holdings Inc. Common Stock,United States
LINK,Interlink Electronics Inc. Common Stock,United States
LIQT,LiqTech International Inc. Common Stock,Denmark
LITB,LightInTheBox Holding Co. Ltd. American Depositary Shares each representing 2 ordinary shares,China
LITE,Lumentum Holdings Inc. Common Stock,United States
LITTU,Logistics Innovation Technologies Corp. Units,United States
LITTW,Logistics Innovation Technologies Corp. Warrant,United States
LIVE,Live Ventures Incorporated Common Stock,United States
LIVN,LivaNova PLC Ordinary Shares,United Kingdom
LIXT,Lixte Biotechnology Holdings Inc. Common Stock,United States
LIXTW,Lixte Biotechnology Holdings Inc. Warrants,United States
LIZI,LIZHI INC. American Depositary Shares,China
LJAQ,LightJump Acquisition Corporation Common Stock,United States
LJAQW,LightJump Acquisition Corporation Warrant,United States
LJPC,La Jolla Pharmaceutical Company Common Stock,United States
LKCO,Luokung Technology Corp Ordinary Shares,China
LKFN,Lakeland Financial Corporation Common Stock,United States
LKQ,LKQ Corporation Common Stock,United States
LL,Lumber Liquidators Holdings Inc Common Stock,United States
LLL,JX Luxventure Limited Common Stock,China
LLNW,Limelight Networks Inc. Common Stock,United States
LLY,Eli Lilly and Company Common Stock,United States
LMACA,Liberty Media Acquisition Corporation Series A Common Stock,United States
LMACU,Liberty Media Acquisition Corporation Unit,United States
LMACW,Liberty Media Acquisition Corporation Warrants,United States
LMAO,LMF Acquisition Opportunities Inc. Class A common stock,United States
LMAOU,LMF Acquisition Opportunities Inc. Unit,United States
LMAOW,LMF Acquisition Opportunities Inc. Warrant,United States
LMAT,LeMaitre Vascular Inc. Common Stock,United States
LMB,Limbach Holdings Inc. Common Stock,United States
LMDX,LumiraDx Limited Common Shares,Cayman Islands
LMDXW,LumiraDx Limited Warrant,Cayman Islands
LMFA,LM Funding America Inc. Common Stock,United States
LMND,Lemonade Inc. Common Stock,United States
LMNL,Liminal BioSciences Inc. Common Shares,Canada
LMNR,Limoneira Co Common Stock,United States
LMPX,LMP Automotive Holdings Inc. Common Stock,United States
LMRK,Landmark Infrastructure Partners LP Common Units,United States
LMRKN,Landmark Infrastructure Partners LP 7% Series C Fltg/Fxd Perpetual Conv Preferred Stock,United States
LMRKO,Landmark Infrastructure Partners LP Perpetual Preferred Units Series B 7.90%,United States
LMRKP,Landmark Infrastructure Partners LP 8.00% Series A Cumulative Redeemable Perpetual Preferred Units,United States
LMST,Limestone Bancorp Inc. Common Stock,United States
LMT,Lockheed Martin Corporation Common Stock,United States
LNC,Lincoln National Corporation Common Stock,United States
LND,Brasilagro Brazilian Agric Real Estate Co Sponsored ADR (Brazil),Brazil
LNDC,Landec Corporation Common Stock (DE),United States
LNFA,L&amp;F Acquisition Corp. Class A Ordinary Shares,United States
LNG,Cheniere Energy Inc. Common Stock,United States
LNN,Lindsay Corporation Common Stock,United States
LNSR,LENSAR Inc. Common Stock,United States
LNT,Alliant Energy Corporation Common Stock,United States
LNTH,Lantheus Holdings Inc. Common Stock,United States
LOAN,Manhattan Bridge Capital Inc,United States
LOB,Live Oak Bancshares Inc. Common Stock,United States
LOCO,El Pollo Loco Holdings Inc. Common Stock,United States
LODE,Comstock Mining Inc. Common Stock,United States
LOGC,LogicBio Therapeutics Inc. Common Stock,United States
LOGI,Logitech International S.A. Ordinary Shares,United States
LOKB,Live Oak Acquisition Corp. II Class A Common Stock,
LOMA,Loma Negra Compania Industrial Argentina Sociedad Anonima ADS,Argentina
LOOP,Loop Industries Inc. Common Stock,Canada
LOPE,Grand Canyon Education Inc. Common Stock,United States
LORL,Loral Space and Communications Inc. Common Stock,United States
LOTZ,CarLotz Inc. Class A Common Stock,United States
LOTZW,CarLotz Inc. Warrant,United States
LOV,Spark Networks Inc. American Depositary Shares (each representing one-tenth of an Ordinary Share),United States
LOVE,The Lovesac Company Common Stock,United States
LOW,Lowe's Companies Inc. Common Stock,United States
LPCN,Lipocine Inc. Common Stock,United States
LPG,Dorian LPG Ltd. Common Stock,
LPI,Laredo Petroleum Inc. Common Stock,United States
LPL,LG Display Co Ltd AMERICAN DEPOSITORY SHARES,South Korea
LPLA,LPL Financial Holdings Inc. Common Stock,United States
LPRO,Open Lending Corporation Class A Common Stock,United States
LPSN,LivePerson Inc. Common Stock,United States
LPTH,LightPath Technologies Inc. Class A Common Stock,United States
LPTX,Leap Therapeutics Inc. Common Stock,United States
LPX,Louisiana-Pacific Corporation Common Stock,United States
LQDA,Liquidia Corporation Common Stock,United States
LQDT,Liquidity Services Inc. Common Stock,United States
LRCX,Lam Research Corporation Common Stock,United States
LRFC,Logan Ridge Finance Corporation Common Stock,United States
LRMR,Larimar Therapeutics Inc. Common Stock,United States
LRN,Stride Inc. Common Stock,United States
LSBK,Lake Shore Bancorp Inc. Common Stock,United States
LSCC,Lattice Semiconductor Corporation Common Stock,United States
LSEA,Landsea Homes Corporation Common Stock,United States
LSEAW,Landsea Homes Corporation Warrant,United States
LSF,Laird Superfood Inc. Common Stock,
LSI,Life Storage Inc. Common Stock,United States
LSPD,Lightspeed Commerce Inc. Subordinate Voting Shares,
LSTR,Landstar System Inc. Common Stock,United States
LSXMA,Liberty Media Corporation Series A Liberty SiriusXM Common Stock,United States
LSXMB,Liberty Media Corporation Series B Liberty SiriusXM Common Stock,United States
LSXMK,Liberty Media Corporation Series C Liberty SiriusXM Common Stock,United States
LTBR,Lightbridge Corporation Common Stock,United States
LTC,LTC Properties Inc. Common Stock,United States
LTCH,Latch Inc. Common Stock,United States
LTCHW,Latch Inc. Warrant expiring 6/4/2026,United States
LTH,Life Time Group Holdings Inc. Common Stock,
LTHM,Livent Corporation Common Stock,United States
LTRN,Lantern Pharma Inc. Common Stock,United States
LTRPA,Liberty TripAdvisor Holdings Inc. Series A Common Stock,United States
LTRPB,Liberty TripAdvisor Holdings Inc. Series B Common Stock,United States
LTRX,Lantronix Inc. Common Stock,United States
LU,Lufax Holding Ltd American Depositary Shares two of which representing one Ordinary Share,China
LUB,Luby's Inc. Common Stock,United States
LULU,lululemon athletica inc. Common Stock,Canada
LUMN,Lumen Technologies Inc. Common Stock,United States
LUMO,Lumos Pharma Inc. Common Stock,United States
LUNA,Luna Innovations Incorporated Common Stock,United States
LUNG,Pulmonx Corporation Common Stock,United States
LUV,Southwest Airlines Company Common Stock,United States
LUXA,Lux Health Tech Acquisition Corp. Class A Common Stock,United States
LUXAU,Lux Health Tech Acquisition Corp. Units,United States
LUXAW,Lux Health Tech Acquisition Corp. Warrants,United States
LVO,LiveOne Inc. Common Stock,United States
LVOX,LiveVox Holding Inc. Class A Common Stock,United States
LVOXW,LiveVox Holding Inc. Warrant,United States
LVRA,Levere Holdings Corp. Class A Ordinary Shares,Cayman Islands
LVRAW,Levere Holdings Corp. Warrant,Cayman Islands
LVS,Las Vegas Sands Corp. Common Stock,United States
LVTX,LAVA Therapeutics N.V. Ordinary Shares,Netherlands
LW,Lamb Weston Holdings Inc. Common Stock ,
LWAY,Lifeway Foods Inc. Common Stock,United States
LWLG,Lightwave Logic Inc. Common Stock,United States
LX,LexinFintech Holdings Ltd. American Depositary Shares,China
LXEH,Lixiang Education Holding Co. Ltd. American Depositary Shares,China
LXFR,Luxfer Holdings PLC Ordinary Shares,United Kingdom
LXP,Lexington Realty Trust Common Stock,United States
LXP^C,Lexington Realty Trust  Preferred Conv. Series C,United States
LXRX,Lexicon Pharmaceuticals Inc. Common Stock,United States
LXU,LSB Industries Inc. Common Stock,United States
