Symbol,Name,Country
PHIC,Population Health Investment Co. Inc. Class A Ordinary Share,United States
PHICW,Population Health Investment Co. Inc. Warrant,United States
PHIO,Phio Pharmaceuticals Corp. Common Stock,United States
PHIOW,Phio Pharmaceuticals Corp. Warrants expiring 12/21/2021,United States
PHK,Pimco High Income Fund Pimco High Income Fund,United States
PHM,PulteGroup Inc. Common Stock,United States
PHR,Phreesia Inc. Common Stock,United States
PHT,Pioneer High Income Fund Inc.,United States
PHUN,Phunware Inc. Common Stock,Greece
PHUNW,Phunware Inc. Warrants,Greece
PHVS,Pharvaris N.V. Ordinary Shares,Netherlands
PHX,PHX Minerals Inc. Common Stock,United States
PI,Impinj Inc. Common Stock,United States
PIAI,Prime Impact Acquisition I Class A Ordinary Shares,
PICC,Pivotal Investment Corporation III Class A Common Stock,
PII,Polaris Inc. Common Stock,United States
PIM,Putnam Master Intermediate Income Trust Common Stock,United States
PINC,Premier Inc. Class A Common Stock,United States
PINE,Alpine Income Property Trust Inc. Common Stock,United States
PING,Ping Identity Holding Corp. Common Stock,United States
PINS,Pinterest Inc. Class A Common Stock,
PIPP,Pine Island Acquisition Corp. Class A Common Stock,United States
PIPR,Piper Sandler Companies Common Stock,United States
PIRS,Pieris Pharmaceuticals Inc. Common Stock,Germany
PIXY,ShiftPixy Inc. Common Stock,United States
PJT,PJT Partners Inc. Class A Common Stock,United States
PK,Park Hotels & Resorts Inc. Common Stock ,United States
PKBK,Parke Bancorp Inc. Common Stock,United States
PKE,Park Aerospace Corp. Common Stock,United States
PKG,Packaging Corporation of America Common Stock,United States
PKI,PerkinElmer Inc. Common Stock,United States
PKO,Pimco Income Opportunity Fund Common Shares of Beneficial Interest,United States
PKOH,Park-Ohio Holdings Corp. Common Stock,United States
PKX,POSCO Common Stock,South Korea
PLAB,Photronics Inc. Common Stock,United States
PLAG,Planet Green Holdings Corp. Common Stock,China
PLAN,Anaplan Inc. Common Stock,United States
PLAY,Dave & Buster's Entertainment Inc. Common Stock,United States
PLBC,Plumas Bancorp,United States
PLBY,PLBY Group Inc. Common Stock,United States
PLCE,Children's Place Inc. (The) Common Stock,United States
PLD,Prologis Inc. Common Stock,United States
PLG,Platinum Group Metals Ltd. Ordinary Shares (Canada),Canada
PLIN,China Xiangtai Food Co. Ltd. Ordinary Shares,China
PLL,Piedmont Lithium Inc. Common Stock,United States
PLM,Polymet Mining Corporation Ordinary Shares (Canada),Canada
PLMI,Plum Acquisition Corp. I Class A Ordinary Share,United States
PLMIU,Plum Acquisition Corp. I Units,United States
PLMIW,Plum Acquisition Corp. I Warrant,United States
PLMR,Palomar Holdings Inc. Common stock,United States
PLNT,Planet Fitness Inc. Common Stock,United States
PLOW,Douglas Dynamics Inc. Common Stock,United States
PLPC,Preformed Line Products Company Common Stock,United States
PLRX,Pliant Therapeutics Inc. Common Stock,United States
PLSE,Pulse Biosciences Inc Common Stock (DE),United States
PLTK,Playtika Holding Corp. Common Stock,Israel
PLTR,Palantir Technologies Inc. Class A Common Stock,
PLUG,Plug Power Inc. Common Stock,United States
PLUS,ePlus inc. Common Stock,United States
PLX,Protalix BioTherapeutics Inc. (DE) Common Stock,Israel
PLXP,PLx Pharma Inc. Common Stock,United States
PLXS,Plexus Corp. Common Stock,United States
PLYA,Playa Hotels & Resorts N.V. Ordinary Shares,Netherlands
PLYM,Plymouth Industrial REIT Inc. Common Stock,United States
PLYM^A,Plymouth Industrial REIT Inc. 7.50% Series A Cumulative Redeemable Preferred Stock,United States
PM,Philip Morris International Inc Common Stock,United States
PMBC,Pacific Mercantile Bancorp Common Stock,United States
PMCB,PharmaCyte  Biotech Inc. Common Stock,United States
PMD,Psychemedics Corporation,United States
PME,Pingtan Marine Enterprise Ltd.,China
PMF,PIMCO Municipal Income Fund Common Stock,United States
PMGM,Priveterra Acquisition Corp. Class A Common Stock,United States
PMGMU,Priveterra Acquisition Corp. Units,United States
PMGMW,Priveterra Acquisition Corp. Warrant,United States
PML,Pimco Municipal Income Fund II Common Shares of Beneficial Interest,United States
PMM,Putnam Managed Municipal Income Trust Common Stock,United States
PMO,Putnam Municipal Opportunities Trust Common Stock,United States
PMT,PennyMac Mortgage Investment Trust Common Shares of Beneficial Interest,United States
PMT^A,PennyMac Mortgage Investment Trust 8.125% Series A Fixed-to-Floating Rate Cumulative Redeemable Preferred Shares of Beneficial Interest,United States
PMT^B,PennyMac Mortgage Investment Trust 8.00% Series B Fixed-to-Floating Rate Cumulative Redeemable Preferred Shares of Beneficial Interest,United States
PMT^C,PennyMac Mortgage Investment Trust 6.75% Series C Cumulative Redeemable Preferred Shares of Beneficial Interest,United States
PMTS,CPI Card Group Inc. Common Stock,United States
PMVC,PMV Consumer Acquisition Corp. Class A Common Stock,United States
PMVP,PMV Pharmaceuticals Inc. Common Stock,United States
PMX,PIMCO Municipal Income Fund III Common Shares of Beneficial Interest,United States
PNBK,Patriot National Bancorp Inc. Common Stock,United States
PNC,PNC Financial Services Group Inc. (The) Common Stock,United States
PNC^P,PNC Financial Services Group Inc. (The) Depositary Shares Representing 1/4000th Perpetual Preferred Series P,United States
PNF,PIMCO New York Municipal Income Fund Common Stock,United States
PNFP,Pinnacle Financial Partners Inc. Common Stock,United States
PNFPP,Pinnacle Financial Partners Inc. Depositary shares of Pinnacle Financial Partners Inc. each representing a 1/40th Interest in a share of its 6.75% Fixed-Rate Non-Cumulative Perpetual Preferred Stock Series B,United States
PNI,Pimco New York Municipal Income Fund II Common Shares of Beneficial Interest,United States
PNM,PNM Resources Inc. (Holding Co.) Common Stock,United States
PNNT,PennantPark Investment Corporation Common Stock,United States
PNNTG,PennantPark Investment Corporation 5.50% Notes Due 2024,United States
PNR,Pentair plc. Ordinary Share,Switzerland
PNRG,PrimeEnergy Resources Corporation Common Stock,United States
PNT,POINT Biopharma Global Inc. Common Stock,United States
PNTG,The Pennant Group Inc. Common Stock ,United States
PNTM,Pontem Corporation Class A Ordinary Shares,
PNW,Pinnacle West Capital Corporation Common Stock,United States
POAI,Predictive Oncology Inc. Common Stock,United States
PODD,Insulet Corporation Common Stock,United States
POLA,Polar Power Inc. Common Stock,United States
POLY,Plantronics Inc. Common Stock,United States
POND,Angel Pond Holdings Corporation Class A Ordinary Shares,
PONO,Pono Capital Corp Class A Common Stock,United States
PONOU,Pono Capital Corp Unit,United States
PONOW,Pono Capital Corp Warrant,United States
POOL,Pool Corporation Common Stock,United States
POR,Portland General Electric Co Common Stock,United States
POSH,Poshmark Inc. Class A Common Stock,United States
POST,Post Holdings Inc. Common Stock,United States
POW,Powered Brands Class A Ordinary Shares,United States
POWI,Power Integrations Inc. Common Stock,United States
POWL,Powell Industries Inc. Common Stock,United States
POWRU,Powered Brands Units,United States
POWRW,Powered Brands Warrants,United States
POWW,AMMO Inc. Common Stock,United States
POWWP,AMMO Inc. 8.75% Series A Cumulative Redeemable Perpetual Preferred Stock,United States
PPBI,Pacific Premier Bancorp Inc,United States
PPBT,Purple Biotech Ltd. American Depositary Shares,Israel
PPC,Pilgrim's Pride Corporation Common Stock,United States
PPD,PPD Inc. Common Stock,United States
PPG,PPG Industries Inc. Common Stock,United States
PPGH,Poema Global Holdings Corp. Class A Ordinary Share,China
PPGHU,Poema Global Holdings Corp. Unit,China
PPGHW,Poema Global Holdings Corp. Warrant,China
PPHP,PHP Ventures Acquisition Corp. Class A Common Stock,Malaysia
PPHPR,PHP Ventures Acquisition Corp. Rights,Malaysia
PPHPW,PHP Ventures Acquisition Corp. Warrants,Malaysia
PPIH,Perma-Pipe International Holdings Inc. Common Stock,United States
PPL,PPL Corporation Common Stock,United States
PPSI,Pioneer Power Solutions Inc. Common Stock,United States
PPT,Putnam Premier Income Trust Common Stock,United States
PPTA,Perpetua Resources Corp. Common Shares,Canada
PRA,ProAssurance Corporation Common Stock,United States
PRAA,PRA Group Inc. Common Stock,United States
PRAX,Praxis Precision Medicines Inc. Common Stock,United States
PRCH,Porch Group Inc. Common Stock,United States
PRCT,PROCEPT BioRobotics Corporation Common Stock,United States
PRDO,Perdoceo Education Corporation Common Stock,United States
PRE^J,PartnerRe Ltd. 4.875% Fixed Rate Non-Cumulative Redeemable Preferred Shares Series J,Bermuda
PRFT,Perficient Inc. Common Stock,United States
PRFX,PainReform Ltd. Ordinary Shares,Israel
PRG,PROG Holdings Inc. Common Stock,United States
PRGO,Perrigo Company plc Ordinary Shares,United States
PRGS,Progress Software Corporation Common Stock (DE),United States
PRI,Primerica Inc. Common Stock,United States
PRIF^D,Priority Income Fund Inc. 7.00% Series D Term Preferred Stock due 2029,
PRIF^F,Priority Income Fund Inc. 6.625% Series F Term Preferred Stock due 2027,
PRIF^G,Priority Income Fund Inc. 6.25% Series G Preferred Stock Due 2026,
PRIF^H,Priority Income Fund Inc. 6.00% Series H Term Preferred Stock due 2026,
PRIF^I,Priority Income Fund Inc. 6.125% Series I Term Preferred Stock due 2028,
PRIF^J,Priority Income Fund Inc. 6.000% Series J Term Preferred Stock due 2028,
PRIF^K,Priority Income Fund Inc. 7.000% Series K Cumulative Preferred Stock,
PRIM,Primoris Services Corporation Common Stock,United States
PRK,Park National Corporation Common Stock,United States
PRLB,Proto Labs Inc. Common stock,United States
PRLD,Prelude Therapeutics Incorporated Common Stock,United States
PRMW,Primo Water Corporation Common Stock,Canada
PRO,PROS Holdings Inc. Common Stock,United States
PROC,Procaps Group S.A. Ordinary Shares,Luxembourg
PROCW,Procaps Group S.A. Warrants,Luxembourg
PROF,Profound Medical Corp. Common Stock,Canada
PROG,Progenity Inc. Common Stock,United States
PROV,Provident Financial Holdings Inc. Common Stock,United States
PRPB,CC Neuberger Principal Holdings II Class A Ordinary Shares,United States
PRPC,CC Neuberger Principal Holdings III Class A Ordinary Shares,
PRPH,ProPhase Labs Inc. Common Stock (DE),United States
PRPL,Purple Innovation Inc. Common Stock,United States
PRPO,Precipio Inc.  Common Stock,United States
PRQR,ProQR Therapeutics N.V. Ordinary Shares,Netherlands
PRS,Prudential Financial Inc. 5.625% Junior Subordinated Notes due 2058,United States
PRSR,Prospector Capital Corp. Class A Ordinary Shares,United States
PRSRU,Prospector Capital Corp. Unit,United States
PRSRW,Prospector Capital Corp. Warrants,United States
PRT,PermRock Royalty Trust Trust Units,United States
PRTA,Prothena Corporation plc Ordinary Shares,United States
PRTC,PureTech Health plc American Depositary Shares,United Kingdom
PRTG,Portage Biotech Inc. Common Stock,Canada
PRTH,Priority Technology Holdings Inc. Common Stock,United States
PRTK,Paratek Pharmaceuticals Inc. Common Stock,United States
PRTS,CarParts.com Inc. Common Stock,United States
PRTY,Party City Holdco Inc. Common Stock,United States
PRU,Prudential Financial Inc. Common Stock,United States
PRVA,Privia Health Group Inc. Common Stock,United States
PRVB,Provention Bio Inc. Common Stock,United States
PSA,Public Storage Common Stock,United States
PSA^E,Public Storage Depositary Shares Each Representing 1/1000 of a 4.90% Cumulative Preferred Share of Beneficial Interest Series E,United States
PSA^F,Public Storage Depositary Shares Each Representing 1/1000 of a 5.15% Cumulative Preferred Share of Beneficial Interest Series F par value $0.01 per share,United States
PSA^G,Public Storage Depositary Shares Each Representing 1/1000 of a 5.05% Cumulative Preferred Share of Beneficial Interest Series G,United States
PSA^H,Public Storage Depositary Shares Each Representing 1/1000 of a  5.60% Cumulative Preferred  Share of Beneficial Interest Series H,United States
PSA^I,Public Storage Depositary Shares Each Representing 1/1000 of a 4.875% Cumulative Preferred Share of Beneficial Interest Series I par value $0.01 per share,United States
PSA^J,Public Storage Depositary Shares Each Representing 1/1000 of a 4.700% Cumulative Preferred Share of Beneficial Interest Series J par value $0.01 per share,United States
PSA^K,Public Storage Depositary Shares Each Representing 1/1000 of a 4.75% Cumulative Preferred Share of Beneficial Interest Series K,United States
PSA^L,Public Storage Depositary Shares Each Representing 1/1000 of a 4.625% Cumulative Preferred Share of Beneficial Interest Series L par value $0.01 per share,United States
PSA^M,Public Storage Depositary Shares Each Representing 1/1000 of a 4.125% Cumulative Preferred Share of Beneficial Interest Series M,United States
PSA^N,Public Storage Depositary Shares Each Representing 1/1000 of a 3.875% Cumulative Preferred Share of Beneficial Interest Series N,United States
PSA^O,Public Storage Depositary Shares Each Representing 1/1000 of a 3.900% Cumulative Preferred Share of Beneficial Interest Series O,United States
PSA^P,Public Storage Depositary Shares Each Representing 1/1000 of a 4.000% Cumulative Preferred Share of Bene cial Interest Series P,United States
PSA^Q,Public Storage Depositary Shares Each Representing 1/1000 of a 3.950% Cumulative Preferred Share of Beneficial Interest Series Q par value $0.01 per share,United States
PSAG,Property Solutions Acquisition Corporation II Class A Common Stock,United States
PSAGU,Property Solutions Acquisition Corporation II Units,United States
PSAGW,Property Solutions Acquisition Corporation II Warrant,United States
PSB,PS Business Parks Inc. (MD) Common Stock,United States
PSB^W,PS Business Parks Inc. Depositary Shares Each Representing 1/1000 of a Share of 5.20% Cumulative Preferred Stock Series W,United States
PSB^X,PS Business Parks Inc. Depositary Shares Each Representing 1/1000 of a Share of 5.25% Cumulative Preferred Stock Series X,United States
PSB^Y,PS Business Parks Inc. 5.20% Cumulative Preferred Stock Series Y,United States
PSB^Z,PS Business Parks Inc. Depositary Shares Each Representing 1/1000 of a Share of 4.875% Cumulative Preferred Stock Series Z  par value $0.01 per share,United States
PSEC,Prospect Capital Corporation Common Stock,United States
PSEC^A,Prospect Capital Corporation 5.35% Series A Fixed Rate Cumulative Perpetual Preferred Stock,United States
PSF,Cohen & Steers Select Preferred and Income Fund Inc. Common Stock,
PSFE,Paysafe Limited Common Shares,
PSHG,Performance Shipping Inc. Common Shares,Greece
PSMT,PriceSmart Inc. Common Stock,United States
PSN,Parsons Corporation Common Stock,
PSNL,Personalis Inc. Common Stock,United States
PSO,Pearson Plc Common Stock,United Kingdom
PSPC,Post Holdings Partnering Corporation Series A Common Stock,
PSTG,Pure Storage Inc. Class A Common Stock,
PSTH,Pershing Square Tontine Holdings Ltd. Class A Common Stock,
PSTI,Pluristem Therapeutics Inc. Common Stock,Israel
PSTL,Postal Realty Trust Inc. Class A Common Stock,
PSTV,PLUS THERAPEUTICS Inc. Common Stock ,United States
PSTX,Poseida Therapeutics Inc. Common Stock,United States
PSX,Phillips 66 Common Stock,United States
PSXP,Phillips 66 Partners LP Common Units representing limited partner interest in the Partnership,United States
PT,Pintec Technology Holdings Limited American Depositary Shares,China
PTA,Cohen & Steers Tax-Advantaged Preferred Securities and Income Fund Common Shares of Beneficial Interest,
PTC,PTC Inc. Common Stock,United States
PTCT,PTC Therapeutics Inc. Common Stock,United States
PTE,PolarityTE Inc. Common Stock,United States
PTEN,Patterson-UTI Energy Inc. Common Stock,United States
PTGX,Protagonist Therapeutics Inc. Common Stock,United States
PTIC,PropTech Investment Corporation II Class A Common Stock,United States
PTICU,PropTech Investment Corporation II Unit,United States
PTICW,PropTech Investment Corporation II Warrant,United States
PTIX,Protagenic Therapeutics Inc. Common Stock,United States
PTIXW,Protagenic Therapeutics Inc. Warrant,United States
PTMN,Portman Ridge Finance Corporation Common Stock,United States
PTN,Palatin Technologies Inc. Common Stock,United States
PTNR,Partner Communications Company Ltd. American Depositary Shares,Israel
PTOC,Pine Technology Acquisition Corp. Class A Common Stock,United States
PTOCU,Pine Technology Acquisition Corp. Unit,United States
PTOCW,Pine Technology Acquisition Corp. Warrant,United States
PTON,Peloton Interactive Inc. Class A Common Stock,United States
PTPI,Petros Pharmaceuticals Inc. Common Stock,United States
PTR,PetroChina Company Limited Common Stock,China
PTRA,Proterra Inc. Common Stock,United States
PTRAW,Proterra Inc. Warrant,United States
PTRS,Partners Bancorp Common Stock,United States
PTSI,P.A.M. Transportation Services Inc. Common Stock,United States
PTVE,Pactiv Evergreen Inc. Common stock,United States
PTY,Pimco Corporate & Income Opportunity Fund,United States
PUBM,PubMatic Inc. Class A Common Stock,United States
PUCK,Goal Acquisitions Corp. Common Stock,United States
PUCKU,Goal Acquisitions Corp. Unit,United States
PUCKW,Goal Acquisitions Corp. Warrant,United States
PUK,Prudential Public Limited Company Common Stock,United Kingdom
PUK^,Prudential Public Limited Company 6.75% Perpetual Subordinated Captial Security,United Kingdom
PUK^A,Prudential Public Limited Company 6.50% Perpetual Subordinated Capital Securities Exchangeable at the Issuer's Option Into Non-Cumulative Dollar Denominated Preference Shares,United Kingdom
PULM,Pulmatrix Inc. Common Stock,United States
PUMP,ProPetro Holding Corp. Common Stock,United States
PUYI,Puyi Inc. American Depository Shares,China
PV,Primavera Capital Acquisition Corporation Class A Ordinary Shares,
PVAC,Penn Virginia Corporation Common Stock,United States
PVBC,Provident Bancorp Inc. (MD) Common Stock,United States
PVG,Pretium Resources Inc. Ordinary Shares (Canada),Canada
PVH,PVH Corp. Common Stock,United States
PVL,Permianville Royalty Trust Trust Units ,United States
PW,Power REIT (MD) Common Stock,United States
PW^A,Power REIT 7.75% Series A Cumulative Perpetual Preferred Stock,United States
PWFL,PowerFleet Inc. Common Stock,United States
PWOD,Penns Woods Bancorp Inc. Common Stock,United States
PWP,Perella Weinberg Partners Class A Common Stock,United States
PWPPW,Perella Weinberg Partners Warrant,United States
PWR,Quanta Services Inc. Common Stock,United States
PWSC,PowerSchool Holdings Inc. Class A Common Stock,
PXD,Pioneer Natural Resources Company Common Stock,United States
PXLW,Pixelworks Inc.  Common Stock,United States
PXS,Pyxis Tankers Inc. Common Stock,Greece
PXSAP,Pyxis Tankers Inc. 7.75% Series A Cumulative Convertible Preferred Shares,Greece
PXSAW,Pyxis Tankers Inc. Warrant,Greece
PYCR,Paycor HCM Inc. Common Stock,United States
PYN,PIMCO New York Municipal Income Fund III Common Shares of Beneficial Interest,United States
PYPD,PolyPid Ltd. Ordinary Shares,Israel
PYPL,PayPal Holdings Inc. Common Stock,United States
PYR,PyroGenesis Canada Inc. Common Shares,Canada
PYS,Merrill Lynch Depositor Inc PPlus Tr Ser RRD-1 Tr Ctf Cl A,United States
PYT,PPlus Tr GSC-2 Tr Ctf Fltg Rate,United States
PYXS,Pyxis Oncology Inc. Common Stock,United States
PZC,PIMCO California Municipal Income Fund III Common Shares of Beneficial Interest,United States
PZG,Paramount Gold Nevada Corp. Common Stock,United States
PZN,Pzena Investment Management Inc Class A Common Stock,United States
PZZA,Papa John's International Inc. Common Stock,United States
QADA,QAD Inc. Class A Common Stock,United States
QADB,QAD Inc. Class B Common Stock,United States
QCOM,QUALCOMM Incorporated Common Stock,United States
QCRH,QCR Holdings Inc. Common Stock,United States
QD,Qudian Inc. American Depositary Shares each representing one Class A Ordinary Share,China
QDEL,Quidel Corporation Common Stock,United States
QFIN,360 DigiTech Inc. American Depositary Shares,China
QFTA,Quantum FinTech Acquisition Corporation Common Stock,
QGEN,Qiagen N.V. Common Shares ,Netherlands
QH,Quhuo Limited American Depository Shares,China
QIPT,Quipt Home Medical Corp. Common Shares,United States
QIWI,QIWI plc American Depositary Shares,Cyprus
QK,Q&K International Group Limited American Depositary Shares,China
QLGN,Qualigen Therapeutics Inc. Common Stock,United States
QLI,Qilian International Holding Group Ltd. Ordinary Shares,China
QLYS,Qualys Inc. Common Stock,United States
QMCO,Quantum Corporation Common Stock,United States
QNST,QuinStreet Inc. Common Stock,United States
QQQX,Nuveen NASDAQ 100 Dynamic Overwrite Fund Shares of Beneficial Interest,United States
QRHC,Quest Resource Holding Corporation Common Stock,United States
QRTEA,Qurate Retail Inc. Series A Common Stock ,United States
QRTEB,Qurate Retail Inc. Series B Common Stock ,United States
QRTEP,Qurate Retail Inc. 8.0% Fixed Rate Cumulative Redeemable Preferred Stock,United States
QRVO,Qorvo Inc. Common Stock,United States
QS,QuantumScape Corporation Class A Common Stock,United States
QSI,Quantum-Si Incorporated Class A Common Stock,United States
QSIAW,Quantum-Si Incorporated Warrant,United States
QSR,Restaurant Brands International Inc. Common Shares,Canada
QTNT,Quotient Limited Ordinary Shares,Switzerland
QTRX,Quanterix Corporation Common Stock,United States
QTT,Qutoutiao Inc. American Depositary Shares,China
QTWO,Q2 Holdings Inc. Common Stock,
QUAD,Quad Graphics Inc Class A Common Stock,United States
QUBT,Quantum Computing Inc. Common Stock,United States
QUIK,QuickLogic Corporation Common Stock,United States
QUMU,Qumu Corporation Common Stock,United States
QUOT,Quotient Technology Inc. Common Stock,
QURE,uniQure N.V. Ordinary Shares,Netherlands
QVCC,QVC Inc. 6.250% Senior Secured Notes due 2068,United States
QVCD,QVC Inc. 6.375% Senior Secured Notes due 2067,United States
R,Ryder System Inc. Common Stock,United States
RA,Brookfield Real Assets Income Fund Inc. Common Stock,
RAAS,Cloopen Group Holding Limited American Depositary Shares each representing two Class A Ordinary Shares,
RACB,Research Alliance Corp. II Class A Common Stock,United States
RACE,Ferrari N.V. Common Shares,
RAD,Rite Aid Corporation Common Stock,United States
RADA,RADA Electronic Industries Ltd. Ordinary Shares,Israel
RADI,Radius Global Infrastructure Inc. Class A Common Stock,United States
RAIL,FreightCar America Inc. Common Stock,United States
RAIN,Rain Therapeutics Inc. Common Stock,United States
RAM,Aries I Acquisition Corporation Class A Ordinary Share,Cayman Islands
RAMMU,Aries I Acquisition Corporation Unit,Cayman Islands
RAMMW,Aries I Acquisition Corporation Warrant,Cayman Islands
RAMP,LiveRamp Holdings Inc. Common Stock,United States
RAND,Rand Capital Corporation Common Stock,United States
RANI,Rani Therapeutics Holdings Inc. Class A Common Stock,United States
RAPT,RAPT Therapeutics Inc. Common Stock,United States
RARE,Ultragenyx Pharmaceutical Inc. Common Stock,United States
RAVE,Rave Restaurant Group Inc. Common Stock,United States
RAVN,Raven Industries Inc. Common Stock,United States
RBA,Ritchie Bros. Auctioneers Incorporated Common Stock,Canada
RBAC,RedBall Acquisition Corp. Class A Ordinary Shares,United States
RBB,RBB Bancorp Common Stock,United States
RBBN,Ribbon Communications Inc. Common Stock,United States
RBCAA,Republic Bancorp Inc. Class A Common Stock,United States
RBCN,Rubicon Technology Inc. Common Stock,United States
RBKB,Rhinebeck Bancorp Inc. Common Stock,United States
RBLX,Roblox Corporation Class A Common Stock,
RBNC,Reliant Bancorp Inc. Common Stock,United States
RBOT,Vicarious Surgical Inc. Class A Common Stock,Hong Kong
RC,Ready Capital Corproation Common Stock,United States
RC^C,Ready Capital Corporation 6.25% Series C Cumulative Convertible Preferred Stock,United States
RC^E,Ready Capital Corporation 6.50% Series E Cumulative Redeemable Preferred Stock,United States
RCA,Ready Capital Corporation 7.00% Convertible Senior Notes due 2023,United States
RCAT,Red Cat Holdings Inc. Common Stock,United States
RCB,Ready Capital Corporation 6.20% Senior Notes due 2026,United States
RCC,Ready Capital Corporation 5.75% Senior Notes due 2026,United States
RCEL,Avita Therapeutics Inc. Common Stock,United States
RCG,RENN Fund Inc Common Stock,United States
RCHG,Recharge Acquisition Corp. Class A Common Stock,United States
RCHGU,Recharge Acquisition Corp. Unit,United States
RCHGW,Recharge Acquisition Corp. Warrant,United States
RCI,Rogers Communication Inc. Common Stock,Canada
RCII,Rent-A-Center Inc. Common Stock,United States
RCKT,Rocket Pharmaceuticals Inc. Common Stock,United States
RCKY,Rocky Brands Inc. Common Stock,United States
RCL,D/B/A Royal Caribbean Cruises Ltd. Common Stock,United States
RCLF,Rosecliff Acquisition Corp I Class A Common Stock,United States
RCLFU,Rosecliff Acquisition Corp I Unit,United States
RCLFW,Rosecliff Acquisition Corp I Warrants,United States
RCM,R1 RCM Inc. Common Stock,United States
RCMT,RCM Technologies Inc. Common Stock,United States
RCON,Recon Technology Ltd. Class A Ordinary Shares,China
RCOR,Renovacor Inc. Common Stock,
RCRT,Recruiter.com Group Inc. Common Stock,United States
RCRTW,Recruiter.com Group Inc. Warrant,United States
RCS,PIMCO Strategic Income Fund Inc.,United States
RCUS,Arcus Biosciences Inc. Common Stock,
RDCM,Radcom Ltd. Ordinary Shares,Israel
RDFN,Redfin Corporation Common Stock,United States
RDHL,Redhill Biopharma Ltd. American Depositary Shares,Israel
RDI,Reading International Inc Class A Common Stock,United States
